fact,
of American adults believe that chocolate milk comes from brown cows.,69
Queen Elizabeth II can’t sit on the Iron Throne from Game of Thrones.,69
The first ever documented feature film was made in Australia in 1906.,69
The first ever documented feature film was made in Australia in 1906.,69
The color red doesn’t really make bulls angry; they are color-blind.,68
If Pinocchio said “My Nose Will Grow Now” it would create a paradox.,68
"After the premiere of 16 and Pregnant, teen pregnancy rates dropped.",68
"In June 2017, the Facebook community reached 2 billion active users.",68
"During the Aztec reign, a slave could be bought for 100 cocoa beans.",68
Nintendo trademarked the phrase “It’s on like Donkey Kong” in 2010.,67
The average American child is given $3.70 per tooth that falls out.,67
It is thought by Russians that eating ice cream will keep you warm.,67
The United States Navy uses Xbox controllers for their periscopes.,66
A dog was the first living creature to be sent into space in 1957.,66
Baby horses can walk and run after just a few hours of being born.,66
The military has used silly string to detect trip wires in Iraq. ,65
Saint Lucia is the only country in the world named after a woman.,65
The country was named after Saint Lucy of Syracuse by the French.,65
Banging your head against a wall for one hour burns 150 calories.,65
Banging your head against a wall for one hour burns 150 calories.,65
Polar bears could eat as many as 10 penguins in a single sitting…,65
Saint Lucia is the only country in the world named after a woman.,65
The following can be read forward and backward: Do geese see God?,65
"In Uganda, around 48% of the population is under 15 years of age.",65
Approximately 10-20% of US power outages are caused by squirrels.,65
Mr. and Mrs. originated from using the words master and mistress.,65
The average male gets bored of a shopping trip after 26 minutes.,64
"Madonna suffers from brontophobia, which is the fear of thunder.",64
The first known recipe of Angel Food Cake was published in 1878.,64
The only letter that doesn’t appear on the periodic table is J.,63
"In California, you can get a ticket if you’re driving too slow.",63
The Battle of Hastings didn’t actually take place in Hastings.,62
"According to Genesis 1:20-22, the chicken came before the egg.",62
There are no visual difference between male and female herons.,62
The word “Android” means a human with a male robot appearance.,62
Albert Einstein had mastered calculus by the tender age of 15.,62
This works by using your brain to act as a radio transmitter.,61
Kleenex tissues were originally used as filters in gas masks.,61
"In Switzerland, it is illegal to flush the toilet after 10pm.",61
A baby octopus is about the size of a flea when it is born.,59
A small child could swim through the veins of a blue whale.,59
If you lift a kangaroo’s tail off the ground it can’t hop.,58
Some insects and small birds see the world in slow motion.,58
The most venomous jellyfish in the world is the Irukandji.,58
Peaches are the third most popular fruit grown in America.,58
Daniel Radcliffe was allergic to his Harry Potter glasses,57
"In Switzerland, it is illegal to own just one guinea pig.",57
"In Switzerland, it is illegal to own just one guinea pig.",57
"Facebook, Instagram, and Twitter are all banned in China.",57
"In total, there are 205 bones in the skeleton of a horse.",57
Clinomania is the excessive desire to lay in bed all day.,57
"If you multiply 1089 x 9 you get the exact reverse, 9801.",57
Akon is the #1 selling artist for ringtones in the world.,57
"If you multiply 1089 x 9 you get the exact reverse, 9801.",57
ABBA turned down 1 billion dollars to do a reunion tour.,56
Hard cheeses have a longer shelf live than soft cheeses.,56
Hard cheeses have a longer shelf live than soft cheeses.,56
May 29 is officially “Put a Pillow on Your Fridge Day”.,55
Pteronophobia is the fear of being tickled by feathers.,55
May 29 is officially “Put a Pillow on Your Fridge Day”.,55
Cherophobia is the irrational fear of fun or happiness.,55
Eagles can hunt down a young deer and fly away with it.,55
Dolly Parton lost in a Dolly Parton look-alike contest.,55
Paraskavedekatriaphobia is the fear of Friday the 13th.,55
15% of iPhone users use an iPhone with a broken screen.,55
"Orlando Bloom has swinophobia, which is a fear of pigs!",55
Elephants can die of a broken heart if their mate dies.,55
A man named Ronald MacDonald robbed a Wendy’s in 2005.,54
A single strand of Spaghetti is called a “Spaghetto”.,53
Bananas are curved because they grow towards the sun.,53
of people text things they could never say in person.,53
"There are a total of 1,710 steps in the Eiffel Tower.",53
A single strand of Spaghetti is called a “Spaghetto”.,53
"In Israel, it is illegal to bring bears to the beach.",53
A single strand of Spaghetti is called a “Spaghetto”.,53
There is a species of spider called the Hobo Spider.,52
The most leaves ever found on a single clover is 56.,52
The name ASOS is an acronym for “As Seen On Screen”.,52
Llamas are actually from the same family as camels.,51
Crows often hold grudges against specific people.,49
Crows often hold grudges against specific people.,49
"Strawberries can be red, yellow, green, or white.",49
Dylan Dauzat‘s fanbase are known as “Dylanators”.,49
Only 2% of the world’s population has green eyes.,49
Four Nile crocodiles have been found in Florida.,48
"At birth, a baby panda is smaller than a mouse.",47
The least common day to be born on is 22nd May.,47
Violin bows are commonly made from horse hair.,46
The smallest bone in your body is in your ear.,46
Octopuses actually have six arms and two legs!,46
Captive pandas may sometimes fake pregnancies.,46
The first alarm clock could only ring at 4 am.,46
Ants leave maps for other ants when they walk.,46
Llamas were in the US long before humans were.,46
The original London Bridge is now in Arizona.,45
Most people fart around 14 to 23 times a day!,45
A lion’s roar can be heard from 5 miles away.,45
The word “y’all” dates back to at least 1631.,45
The Twitter bird actually has a name – Larry.,45
Male cats have longer tails than female cats.,45
Lettuce is a member of the sunflower family.,44
Bob Dylan’s birth name was Robert Zimmerman.,44
There is a town in India called Santa Claus.,44
There is a town in India called Santa Claus.,44
Pope Francis used to be a nightclub bouncer.,44
Car manufacturer Volkswagen makes sausages.,43
March 20th is known as Snowman Burning Day.,43
There is an official Wizard of New Zealand.,43
Nearly every brand of hard liquor is vegan.,43
Most Korean people don’t have armpit odor.,42
A polygon with 30 sides is a triacontagon.,42
Eating carrots can turn your skin orange.,41
Iceland does not have a railway system.,39
Snakes are able to predict earthquakes.,39
Only 5% of the ocean has been explored.,39
A crocodile can’t poke its tongue out.,38
George W. Bush was once a cheerleader.,38
Zebras have only one toe on each foot.,38
A baby spider is called a spiderling.,37
Honeybees can recognize human faces.,36
The atomic number of zinc is 30.,32
A snail can sleep for 3 years.,30
Cranes are built using cranes.,30
Pigs are very smart animals.,28
A sunset on Mars is blue.,25
,0
